<?xml version="1.0" encoding="UTF-8"?>
<!DOCTYPE akomantoso SYSTEM "../schemas/akomantoso10.dtd">
<?xml-stylesheet type="text/xsl" href="../styles/akomantoso.xsl"?>
<akomantoso xmlns="http://www.akomantoso.org/1.0">
    <doc>
        <meta>
            <descriptor>
                <publication date="2005-08-29" type="internal"/>
                <enactmentDate date="2005-08-29"/>
                <editors>
                    <editor date="2005-08-29" name="Mary Smith" id="clerk125" contribution="markup"
                    />
                </editors>
                <uri href="urn:an:sa_doc_20050829_en"/>
            </descriptor>
        </meta>
        <preface>
            <p class="important">PARLIAMENT OF THE REPUBLIC OF SOUTH AFRICA</p>
            <p class="important">ANNOUNCEMENTS, TABLINGS AND COMMITTEE REPORTS</p>
            <p class="important">MONDAY, 29 AUGUST 2005</p>
        </preface>
        <maincontent>
            <item id="toc">
                <title>TABLE OF CONTENTS</title>
                <toc>
                    <tocitem level="1" idref="announcements">ANNOUNCEMENTS</tocitem>
                    <tocitem level="2" idref="ann-NANCP">National Assembly and National Council of
                        Provinces</tocitem>
                    <tocitem level="3" idref="ann-NANCP-Bills">Introduction of Bills</tocitem>
                    <tocitem level="3" idref="ann-NANCP-Classification">Classification of Bills by
                        JTM</tocitem>
                    <tocitem level="2" idref="ann-NA">National Assembly</tocitem>
                    <tocitem level="3" idref="ann-NA-Membership">Membership of Committees</tocitem>
                    <tocitem level="1" idref="tablings">TABLINGS</tocitem>
                    <tocitem level="2" idref="tablings-NANCP">National Assembly and National Council
                        of Provinces</tocitem>
                    <tocitem level="3" idref="tablings-NANCP-Speaker">Speaker and Chairperson</tocitem>
                    <tocitem level="3" idref="tablings-NANCP-Minister">Minister in The Presidency</tocitem>
                    <tocitem level="1" idref="reports">COMMITTEE REPORTS</tocitem>
                    <tocitem level="2" idref="reports-NA">National Assembly</tocitem>
                    <tocitem level="3" idref="reports-NA-itm1">Finance</tocitem>
                </toc>
            </item>
            <item id="announcements">
                <title>ANNOUNCEMENTS</title>
                <item id="ann-NANCP">
                    <title>National Assembly and National Council of Provinces</title>
                    <subtitle>The Speaker and the Chairperson</subtitle>
                    <item id="ann-NANCP-Bills">
                        <num>1.</num>
                        <title>Introduction of Bills</title>
                        <item id="ann-NANCP-Bills-MinisterEnergy">
                            <num>(1)</num>
                            <title>The Minister of Minerals and Energy</title>
                            <item id="ann-NANCP-Bills-MinisterEnergy-B27">
                                <num>(i)</num>
                                <title>Diamonds Amendment Bill [B 27—2005] (National Assembly—sec
                                    75)</title>
                                <p>[Bill and prior notice of its introduction published in
                                    Government Gazette No 27929 of 19 August 2005.]</p>
                            </item>
                            <p>Introduction and referral to the <b>Portfolio Committee on Minerals
                                    and Energy</b> of the National Assembly, as well as referral to
                                the Joint Tagging Mechanism (JTM) for classification in terms of
                                Joint Rule 160, on 30 August 2005.</p>
                            <p>In terms of Joint Rule 154 written views on the classification of the
                                Bill may be submitted to the JTM within three parliamentary working
                                days.</p>
                        </item>
                    </item>
                    <item id="ann-NANCP-Classification">
                        <num>2.</num>
                        <title>Classification of Bill by Joint Tagging Mechanism:</title>
                        <item id="ann-NANCP-Classification-itm1">
                            <p>The Joint Tagging Mechanism (JTM) on 29 August 2005 in terms of Joint
                                Rule 160(4), classified the <ref href="urn:papi:sa_bill_2005_24"
                                    >Forestry Laws Amendment Bill [B 24—2005]</ref>, introduced in
                                the National Assembly, as a section 76 Bill and as a Bill falling
                                within the ambit of <ref href="urn:papi:sa_act_2003_41">section
                                    18(1) of the Traditional Leadership and Governance Framework
                                    Act, 2003 (Act No. 41 of 2003)</ref>.</p>
                        </item>
                    </item>
                </item>
                <item id="ann-NA">
                    <title>National Assembly</title>
                    <subtitle>The Speaker</subtitle>
                    <item id="ann-NA-Membership">
                        <num>1.</num>
                        <title>Membership of Committees</title>
                        <item id="ann-NA-Membership-itm1">
                            <p>The following changes have been made to the membership of
                                    <b>Portfolio Committees</b>, viz: </p>
                            <p>
                                <b>Housing: </b>
                            </p>
                            <p>Appointed: Cupido, Mr H B</p>
                            <p>Discharged: Khumalo, Rev M S </p>
                            <p>
                                <b>Trade and Industry: </b>
                            </p>
                            <p>Appointed: Cupido, Mr H B</p>
                        </item>
                    </item>
                </item>
            </item>
            <item id="tablings">
                <title>TABLINGS</title>
                <item id="tablings-NANCP">
                    <title>National Assembly and National Council of Provinces</title>
                    <item id="tablings-NANCP-Speaker">
                        <num>1.</num>
                        <title>The Speaker and the Chairperson</title>
                        <item id="tablings-NANCP-Speaker-itm1">
                            <p>Report and Financial Statements of the Municipal Demarcation Board
                                for 2004-2005, including the Report of the Auditor-General on the
                                Financial Statements for 2004-2005 [RP 149-2005].</p>
                        </item>
                    </item>
                    <item id="tablings-NANCP-Minister">
                        <num>2.</num>
                        <title>The Minister in The Presidency</title>
                        <item id="tablings-NANCP-Minister-itm1">
                            <p>Report and Financial Statements of the International Marketing
                                Council (IMC) for 2004-2005, including the Report of the Auditor-
                                General on the Financial Statements for 2004-2005.</p>
                        </item>
                    </item>
                </item>
            </item>
            <item id="reports">
                <title>COMMITTEE REPORTS</title>
                <item id="reports-NA">
                    <title>National Assembly:</title>
                    <item id="reports-NA-itm1">
                        <p>Report of the Portfolio Committee on Finance on the <b>Agreement between
                                the Government of the Republic of South Africa and the Government of
                                Malaysia for the Avoidance of Double Taxation and the Prevention of
                                Fiscal Evasion with respect to Taxes</b>, dated 17 August 2005:</p>
                        <p class="indented">The Portfolio Committee on Finance, having considered
                            the request for approval by Parliament of the <b>Agreement between the
                                Government of the Republic of South Africa and the Government of
                                Malaysia for the Avoidance of Double Taxation and the Prevention of
                                Fiscal Evasion with respect to Taxes</b>, referred to it, recommends
                            that the House, in terms of <ref href="urn:papi:sa_const_en#art231-cla2"
                                >section 231(2) of the Constitution</ref>, approve the said
                            Agreement.</p>
                        <p>Request to be considered.</p>
                    </item>
                </item>
            </item>
        </maincontent>
    </doc>
</akomantoso>
